<?xml version="1.0" encoding="utf-8"?>
<!DOCTYPE gnomedoc SYSTEM "dtd/masxmlpd.dtd">
<gnomedoc>
<header>
<fileDesc>

<titleStmt>
<title>Fatal hilarity</title>
<author>Wikipedia</author></titleStmt>
<publicationStmt>
<web>
<publisher>Wikipedia</publisher>
<url>http://en.wikipedia.org/wiki/Fatal_hilarity</url></web>
<availability>All text is available under the terms of the GNU Free Documentation License</availability>
<date>3 December 2008</date></publicationStmt>
<sourceDesc>
<filename>data\game\wikipedia\unusual\Fatal_hilarity.htm</filename>
<date>3 December 2008</date></sourceDesc></fileDesc>
<revisionDesc>
<change>
<date>20 January 2022</date>
<respStmt>
<name>Juntao Yu</name>
<resp>Automatic Processing</resp>
</respStmt>
<TEIitem>Apply hidden markables and markable boundary changes</TEIitem>
</change>
<change>
<date>19 Jan 2022</date>
<respStmt>
<name>Phrase Detectives (Jon Chamberlain)</name>
<resp>Automatic Processing</resp>
</respStmt>
<TEIitem>Exported the document and annotations from the Phrase Detectives game (draft markables)</TEIitem>
</change>
<change>
<date>2009-05-08 14:27:53</date>
<respStmt>
<name>Phrase Detectives</name>
<resp>Automatic Processing</resp>
</respStmt>
<TEIitem>The document has been marked as complete (all markables are sufficiently annotated according to game criteria)</TEIitem>
</change>

<change>
<date>3 December 2008</date>
<respStmt>
<name>Mark Schellhase</name>
<resp>Automatic Processing</resp></respStmt>
<TEIitem>File converted to MASXML by automatic processing from HTML</TEIitem></change><change><date>23 April 2023</date><respStmt><name>Juntao Yu</name><resp>Automatic Processing</resp></respStmt><TEIitem>Add MPA and dali-full-anaphora-system annotations to the file.</TEIitem></change></revisionDesc>
</header>
<body>
<section>
<p id="p1">
<s id="s1">
<unit id="unit1"><ne AAcat="bare-np" AAgen="neut" AAnum="sing" AAper="per3" id="ne61200"><mod AAcat="AApre" id="AAm1"><W Lpos="JJ">Fatal</W></mod>
<nphead id="AAh1"><W Lpos="NN">hilarity</W></nphead></ne>
<ve id="ve1"><W Lpos="VBZ">refers</W></ve>
<W Lpos="TO">to</W>
<ne id="ne61201"><ne AAcat="bare-np" AAgen="neut" AAnum="sing" AAper="per3" id="ne61202"><W Lpos="NN">death</W></ne>
<ve id="ve2"><W Lpos="VBG">resulting</W></ve>
<W Lpos="IN">from</W>
<ne id="ne61203"><ne AAcat="the-np" AAgen="neut" AAnum="plur" AAper="per3" id="ne61204"><W Lpos="DT">the</W>
<mod AAcat="AApre" id="AAm2"><W Lpos="JJ">physiological</W></mod>
<W Lpos="NNS">effects</W></ne>
<W Lpos="IN">of</W>
<ne AAcat="bare-np" AAgen="neut" AAnum="sing" AAper="per3" id="ne61205"><nphead id="AAh2"><W Lpos="NN">laughter</W></nphead></ne></ne></ne>
<W Lpos=".">.</W></unit>
</s>
<PDante id="ne61200">
      <interpretation>
        <anchor agree="y" annotation_time="7" interface="0" mode="a" timestamp="2008-12-05 17:09:19" type="DN" user_id="4661c8b69624681d10ca5e0ee0a95786" user_rating="90" />
        <anchor agree="y" annotation_time="67" interface="0" mode="a" timestamp="2008-12-08 11:15:43" type="DN" user_id="15ee2757e06ae2e37323b889b40bf1e2" user_rating="100" />
        <anchor agree="y" annotation_time="70" interface="0" mode="a" timestamp="2008-12-09 16:40:23" type="DN" user_id="aee2b5ea7fdd43a086cb18b78f147727" user_rating="81" />
        <anchor agree="y" annotation_time="22" interface="0" mode="a" timestamp="2008-12-09 19:29:41" type="DN" user_id="c110584df2df3212114ad52c62d8f4f5" user_rating="90" />
        <anchor agree="y" annotation_time="7" interface="0" mode="a" timestamp="2008-12-09 21:46:43" type="DN" user_id="dcdd5016272c02bb97a138227ba7b5d6" user_rating="75" />
        <anchor agree="y" annotation_time="16" interface="0" mode="a" timestamp="2008-12-11 11:30:49" type="DN" user_id="eb1047e4a2c41644eddb434510348a28" user_rating="80" />
        <anchor agree="y" annotation_time="50" interface="0" mode="a" timestamp="2008-12-11 15:42:56" type="DN" user_id="ff8fd304f13361a6afa8ce7e945f4826" user_rating="55" />
        <anchor agree="y" annotation_time="11" interface="0" mode="a" timestamp="2008-12-11 15:57:05" type="DN" user_id="8464409b210f860769d308451450fdfe" user_rating="90" />
        <anchor agree="y" annotation_time="9" interface="0" mode="a" timestamp="2008-12-11 16:10:39" type="DN" user_id="07aab27d11d8aa01b90464e4e05773d1" user_rating="77" />
        <anchor agree="y" annotation_time="14" interface="0" mode="a" timestamp="2008-12-11 16:18:57" type="DN" user_id="73c1f07cc69e3e4211062fc8df027599" user_rating="66" />
        <anchor agree="y" annotation_time="46" interface="0" mode="a" timestamp="2009-05-08 14:21:48" type="DN" user_id="42d32752bd519da44b8d707ccdcf65dc" user_rating="75" />
        <anchor favoured="y" mode="e" timestamp="2009-03-31 12:01:09" type="DN" user_id="e2" />
        <anchor mode="e" timestamp="2009-04-15 20:27:11" type="DN" user_id="e18" />
      <anchor favoured="y" mode="e" timestamp="2023-04-25 11:50:00" type="DN" user_id="e99" /><anchor timestamp="2023-04-25 11:56:14" type="DN" user_id="MPA" /><anchor timestamp="2023-04-25 11:56:14" type="DN" user_id="dali-full-anaphora-system" /></interpretation>
    </PDante>
<PDante id="ne61201">
      <interpretation>
        <anchor agree="y" annotation_time="10" ante="ne61200" interface="0" mode="a" timestamp="2008-12-08 11:15:55" type="DO" user_id="15ee2757e06ae2e37323b889b40bf1e2" user_rating="100" />
        <anchor agree="y" annotation_time="94" ante="ne61200" interface="0" mode="a" timestamp="2008-12-11 15:58:54" type="DO" user_id="8464409b210f860769d308451450fdfe" user_rating="90" />
        <anchor agree="y" annotation_time="17" ante="ne61200" interface="0" mode="a" timestamp="2008-12-11 16:55:08" type="DO" user_id="24823915ab68b00a47d712f3967ed327" user_rating="72" />
        <anchor agree="y" annotation_time="2" ante="ne61200" interface="0" mode="a" timestamp="2008-12-11 19:05:55" type="DO" user_id="a399965d061dc0818ab4a087237c094d" user_rating="70" />
        <anchor agree="y" annotation_time="18" ante="ne61200" interface="0" mode="a" timestamp="2008-12-11 20:14:37" type="DO" user_id="00e6edca25ffe8f72efd33ca38c9584b" user_rating="92" />
        <anchor agree="y" annotation_time="12" ante="ne61200" interface="0" mode="v" timestamp="2008-12-13 12:28:45" type="DO" user_id="4b98139794ccdffa0776c49881853dcf" user_rating="69" />
        <anchor agree="y" annotation_time="10" ante="ne61200" interface="0" mode="v" timestamp="2008-12-16 16:40:37" type="DO" user_id="7022eda7a118059ed6295be780b3eee9" user_rating="57" />
        <anchor agree="y" annotation_time="4" ante="ne61200" interface="0" mode="v" timestamp="2008-12-22 11:59:57" type="DO" user_id="7022eda7a118059ed6295be780b3eee9" user_rating="57" />
        <anchor agree="y" annotation_time="8" ante="ne61200" interface="0" mode="v" timestamp="2008-12-23 13:45:22" type="DO" user_id="07770b41e1f032cfaa09012e1706e99e" user_rating="85" />
        <anchor agree="n" annotation_time="22" ante="ne61200" interface="0" mode="v" timestamp="2008-12-12 15:54:22" type="DO" user_id="1cc1fdd4fd16ea7d492c436b8adbc93c" user_rating="64" />
        <anchor ante="ne61200" mode="e" timestamp="2009-04-15 20:27:55" type="DO" user_id="e18" />
        <anchor agree="y" annotation_time="29" interface="0" mode="a" timestamp="2008-12-09 16:40:57" type="DN" user_id="aee2b5ea7fdd43a086cb18b78f147727" user_rating="81" />
        <anchor agree="y" annotation_time="5" interface="0" mode="a" timestamp="2008-12-09 19:29:50" type="DN" user_id="c110584df2df3212114ad52c62d8f4f5" user_rating="90" />
        <anchor agree="y" annotation_time="16" interface="0" mode="a" timestamp="2008-12-11 11:31:08" type="DN" user_id="eb1047e4a2c41644eddb434510348a28" user_rating="80" />
        <anchor agree="y" annotation_time="14" interface="0" mode="a" timestamp="2008-12-11 16:19:16" type="DN" user_id="73c1f07cc69e3e4211062fc8df027599" user_rating="66" />
        <anchor agree="y" annotation_time="13" interface="0" mode="a" timestamp="2008-12-14 09:37:19" type="DN" user_id="194d9de614706d298b46b549c65b489a" user_rating="90" />
        <anchor agree="y" annotation_time="5" interface="0" mode="a" timestamp="2008-12-20 22:53:09" type="DN" user_id="aee2b5ea7fdd43a086cb18b78f147727" user_rating="81" />
        <anchor agree="y" annotation_time="2" interface="0" mode="a" timestamp="2008-12-29 00:17:55" type="DN" user_id="aee2b5ea7fdd43a086cb18b78f147727" user_rating="81" />
        <anchor agree="y" annotation_time="3" interface="0" mode="a" timestamp="2008-12-29 00:22:27" type="DN" user_id="aee2b5ea7fdd43a086cb18b78f147727" user_rating="81" />
        <anchor agree="y" annotation_time="13" interface="0" mode="a" timestamp="2009-05-08 14:22:07" type="DN" user_id="42d32752bd519da44b8d707ccdcf65dc" user_rating="75" />
        <anchor agree="y" annotation_time="11" interface="0" mode="v" timestamp="2008-12-13 22:17:52" type="DN" user_id="76ed0707fdb8d0b6275edf4a2ff21fe2" user_rating="55" />
        <anchor agree="y" annotation_time="13" interface="0" mode="v" timestamp="2008-12-19 18:06:25" type="DN" user_id="f2d57b97a64ed92cd495cc2cbd22a9a5" user_rating="66" />
        <anchor agree="y" annotation_time="10" interface="0" mode="v" timestamp="2008-12-25 14:07:42" type="DN" user_id="ce6f0357565562b847acf544199cca8e" user_rating="92" />
        <anchor agree="n" annotation_time="11" interface="0" mode="v" timestamp="2008-12-11 19:05:51" type="DN" user_id="a399965d061dc0818ab4a087237c094d" user_rating="70" />
        <anchor agree="n" annotation_time="4" interface="0" mode="v" timestamp="2008-12-20 22:52:55" type="DN" user_id="aee2b5ea7fdd43a086cb18b78f147727" user_rating="81" />
        <anchor favoured="y" mode="e" timestamp="2009-04-23 12:50:53" type="DN" user_id="e2" />
        <anchor favoured="y" mode="e" timestamp="2009-04-15 20:27:55" type="DN" user_id="e18" />
        <anchor agree="y" annotation_time="19" ante="ne61200" interface="0" mode="a" timestamp="2008-12-09 21:47:05" type="PR" user_id="dcdd5016272c02bb97a138227ba7b5d6" user_rating="75" />